# name: test/sql/replication/replicate_share.test
# description: share mode - zero-copy file registration between ducklake catalogs
# group: [replication]

require ducklake

require parquet

statement ok
ATTACH 'ducklake:{TEST_DIR}/share_src.db' AS share_src (DATA_PATH '{TEST_DIR}/share_src_files')

statement ok
ATTACH 'ducklake:{TEST_DIR}/share_dst.db' AS share_dst (DATA_PATH '{TEST_DIR}/share_dst_files')

# write files directly - share mode cannot represent live inlined rows
statement ok
CALL ducklake_set_option('share_src', 'data_inlining_row_limit', 0)

statement ok
CREATE TABLE share_src.main.t (id INTEGER, v VARCHAR)

statement ok
INSERT INTO share_src.main.t VALUES (1, 'a'), (2, 'b'), (3, 'c')

# share requires a ducklake source - a native catalog is rejected at job creation
statement error
SELECT * FROM ducklake_replicate_create('share_dst', 'memory', data_sync_mode := 'share')
----
<REGEX>:.*share mode requires a DuckLake source.*

# invalid modes are still rejected
statement error
SELECT * FROM ducklake_replicate_create('share_dst', 'share_src', data_sync_mode := 'bogus')
----
<REGEX>:.*data_sync_mode.*

query I
SELECT replication_id FROM ducklake_replicate_create('share_dst', 'share_src', data_sync_mode := 'share')
----
1

query IIII
SELECT replication_id, tables_synced, tables_failed, rows_copied FROM ducklake_replicate_catchup('share_dst', 1)
----
1	1	0	3

query III
SELECT source_table, strategy, row_count_dest FROM ducklake_replicate_tables('share_dst', 1)
----
t	share	3

# zero copy: the dest registration points at the source's data path
query I
SELECT data_file LIKE '%share_src_files%' FROM ducklake_list_files('share_dst', 't', schema => 'main')
----
true

query II
SELECT id, v FROM share_dst.main.t ORDER BY id
----
1	a
2	b
3	c

# idempotent: a second catchup re-registers nothing
query IIII
SELECT replication_id, tables_synced, tables_failed, rows_copied FROM ducklake_replicate_catchup('share_dst', 1)
----
1	1	0	3

query I
SELECT COUNT(*) FROM ducklake_list_files('share_dst', 't', schema => 'main')
----
1

# inserts + deletes + updates propagate via file-set reconciliation
statement ok
INSERT INTO share_src.main.t VALUES (4, 'd')

statement ok
DELETE FROM share_src.main.t WHERE id = 2

statement ok
UPDATE share_src.main.t SET v = 'aa' WHERE id = 1

statement ok
SELECT * FROM ducklake_replicate_catchup('share_dst', 1)

query II
SELECT id, v FROM share_dst.main.t ORDER BY id
----
1	aa
3	c
4	d

# compaction on the source swaps the registered file set on the dest
statement ok
INSERT INTO share_src.main.t VALUES (5, 'e')

statement ok
CALL ducklake_merge_adjacent_files('share_src', 't', schema => 'main')

statement ok
SELECT * FROM ducklake_replicate_catchup('share_dst', 1)

query II
SELECT id, v FROM share_dst.main.t ORDER BY id
----
1	aa
3	c
4	d
5	e

# a new schema + table on the source is picked up on the next cycle
statement ok
CREATE SCHEMA share_src.extra

statement ok
CREATE TABLE share_src.extra.t2 (x INTEGER)

statement ok
INSERT INTO share_src.extra.t2 VALUES (10), (20)

statement ok
SELECT * FROM ducklake_replicate_catchup('share_dst', 1)

query I
SELECT x FROM share_dst.extra.t2 ORDER BY x
----
10
20

# partitioned source tables are rejected - partition values do not travel with the files
statement ok
CREATE TABLE share_src.main.pt (id INTEGER, p VARCHAR)

statement ok
ALTER TABLE share_src.main.pt SET PARTITIONED BY (p)

statement ok
INSERT INTO share_src.main.pt VALUES (1, 'a')

statement ok
SELECT * FROM ducklake_replicate_catchup('share_dst', 1)

query II
SELECT source_table, last_error LIKE '%partitioned%' FROM ducklake_replicate_tables('share_dst', 1)
WHERE source_table = 'pt'
----
pt	true

# live inlined rows are rejected - they are not files and cannot be shared
statement ok
CREATE TABLE share_src.main.inl (id INTEGER)

statement ok
CALL ducklake_set_option('share_src', 'data_inlining_row_limit', 100)

statement ok
INSERT INTO share_src.main.inl VALUES (1)

statement ok
SELECT * FROM ducklake_replicate_catchup('share_dst', 1)

query II
SELECT source_table, last_error LIKE '%inlined%' FROM ducklake_replicate_tables('share_dst', 1)
WHERE source_table = 'inl'
----
inl	true

# after a flush the table becomes shareable again
statement ok
CALL ducklake_flush_inlined_data('share_src', table_name => 'inl', schema_name => 'main')

statement ok
SELECT * FROM ducklake_replicate_catchup('share_dst', 1)

query I
SELECT id FROM share_dst.main.inl
----
1

# ownership: dropping the dest table + expiring + cleaning must not delete source bytes
statement ok
DROP TABLE share_dst.main.inl

statement ok
CALL ducklake_expire_snapshots('share_dst', versions := [0,1,2,3,4,5,6,7,8,9])

statement ok
CALL ducklake_cleanup_old_files('share_dst', cleanup_all => true)

query I
SELECT id FROM share_src.main.inl
----
1

# source drop removes the dest table
statement ok
DROP TABLE share_src.main.t

statement ok
SELECT * FROM ducklake_replicate_catchup('share_dst', 1)

statement error
SELECT * FROM share_dst.main.t
----
<REGEX>:.*does not exist.*

# dest cleanup must not touch files it never owned (the dropped table's registrations pointed at
# source paths)
statement ok
CALL ducklake_expire_snapshots('share_dst', versions := [0,1,2,3,4,5,6,7,8,9,10,11,12,13,14,15,16,17,18,19,20])

statement ok
CALL ducklake_cleanup_old_files('share_dst', cleanup_all => true)
