# name: test/sql/materialized_view/ducklake_materialized_view_minmax.test
# description: MIN/MAX views use key-recompute incremental (not pure delta)
# group: [materialized_view]

require ducklake

require parquet

statement ok
ATTACH 'ducklake:__TEST_DIR__/mv_minmax.db' AS ducklake (DATA_PATH '__TEST_DIR__/mv_minmax_files')

statement ok
CREATE TABLE ducklake.b AS SELECT i AS id, 1 AS grp, i AS val FROM range(5) t(i)

statement ok
SELECT * FROM ducklake_create_materialized_view('ducklake', view_name := 'mvm',
  query := 'SELECT grp, min(val) AS mn, max(val) AS mx, sum(val) AS s FROM b GROUP BY grp')

# delete non-extremum → key-recompute incremental (MIN/MAX block pure delta)
statement ok
DELETE FROM ducklake.b WHERE id = 2

query T
SELECT refresh_mode FROM ducklake_refresh_materialized_view('ducklake', view_name := 'mvm')
----
incremental

query IIII
SELECT grp, mn, mx, s FROM ducklake.mvm
----
1	0	4	8

# delete current max → still incremental, values update
statement ok
DELETE FROM ducklake.b WHERE id = 4

query TTTI
SELECT schema_name, view_name, refresh_mode, rows_refreshed
FROM ducklake_refresh_materialized_view('ducklake', view_name := 'mvm')
----
main	mvm	incremental	1

query IIII
SELECT grp, mn, mx, s FROM ducklake.mvm
----
1	0	3	4
