# name: test/sql/delete/vortex_delete_legacy_missing_mapping_after_rename_add_files.test
# description: Vortex twin of delete_legacy_missing_mapping_after_rename_add_files
# group: [delete]

require ducklake

require vortex

test-env DUCKLAKE_CONNECTION __TEST_DIR__/{UUID}.db

test-env DATA_PATH __TEST_DIR__

statement ok
SET ducklake_default_data_file_format = 'vortex';

statement ok
ATTACH 'ducklake:${DUCKLAKE_CONNECTION}' AS ducklake (DATA_PATH '${DATA_PATH}/vortex_delete_legacy_missing_mapping', METADATA_CATALOG 'ducklake_meta', DATA_INLINING_ROW_LIMIT 0)

statement ok
CREATE TABLE ducklake.t(old_id INTEGER, payload VARCHAR)

statement ok
COPY (
    SELECT 42 AS old_id, 'old' AS payload
    UNION ALL
    SELECT 43 AS old_id, 'old2' AS payload
) TO '${DATA_PATH}/vortex_delete_legacy_source.vortex' (FORMAT vortex)

statement ok
CALL ducklake_add_data_files('ducklake', 't', '${DATA_PATH}/vortex_delete_legacy_source.vortex')

statement ok
ALTER TABLE ducklake.t RENAME COLUMN old_id TO id

# Model a legacy v0.3 file that never had a persisted name mapping.
statement ok
UPDATE ducklake_meta.ducklake_data_file SET mapping_id = NULL

query I
SELECT COUNT(*) FROM ducklake.t WHERE id = 42
----
1

query III
SELECT rowid, id, payload FROM ducklake.t ORDER BY rowid
----
0	42	old
1	43	old2

statement ok
DELETE FROM ducklake.t WHERE id = 42

query II
SELECT id, payload FROM ducklake.t ORDER BY id
----
43	old2